question,answer
What is road traffic order and safety?,"Road traffic order and safety refers to the state of traffic on the road that is orderly, ensures safety, and is smooth. It is formed and regulated by rules, principles, and legal norms in the field of road traffic."
What are road traffic vehicles?,"Road traffic vehicles are types of vehicles, including: motorized road vehicles (hereinafter referred to as motor vehicles), non-motorized road vehicles (hereinafter referred to as non-motorized vehicles), special-use motorcycles, and similar vehicles."
What is the definition of a priority road?,"A priority road is a road where vehicles participating in road traffic are given priority, with vehicles from other directions yielding when passing an intersection, marked by a priority road sign."
What is a roadway?,A roadway is the part of the road used by vehicles for traveling.
What is vehicle modification?,"Vehicle modification (hereinafter referred to as modification) refers to changing the characteristics of a vehicle that has been registered and issued a license plate or an imported second-hand vehicle, which results in a change in the vehicle type as regulated by the competent authority."
Who are the participants in road traffic?,"Participants in road traffic include: the driver, passengers on vehicles participating in road traffic; those driving or leading animals on the road; pedestrians on the road."
What is road traffic congestion?,"Road traffic congestion (hereinafter referred to as traffic congestion) is a situation where people and vehicles participating in road traffic are stuck, moving very slowly, or unable to move at all."
What is a road traffic accident?,"A road traffic accident is a collision involving people and vehicles in road traffic, occurring unexpectedly and causing damage to the lives, health, or property of individuals or organizations."
What are child safety devices?,"Child safety devices are devices designed to ensure the safety of children sitting or lying in a car, designed to reduce the risk of injury to the user in case of a collision or sudden deceleration, by restricting the movement of the child's body."
What are smart devices supporting traffic command and control?,"Smart devices supporting traffic command and control are technological devices capable of detecting, analyzing, and evaluating road traffic situations and violations of road laws; used by the authorities to assist in directing, controlling traffic, resolving situations, and handling legal violations on the road."
What is road transport activity?,"Road transport activities include planning, investment, construction, management, use, operation, exploitation, maintenance, and protection of road infrastructure, as well as road transportation."
What does the road system include?,"The road system includes roads, road bridges, road culverts, road tunnels, road ferries, floating bridges, emergency roads, and auxiliary structures associated with roads."
What are road structures?,"Road structures include roads; facilities for the management, operation, and exploitation of roads; intelligent traffic management systems; road maintenance stations; storage facilities for equipment and spare materials; vehicle weight control facilities; toll stations; and other road-related structures."
What does road infrastructure include?,"Road infrastructure includes road structures, bus stations, parking lots, rest stops, vehicle stops and parking spots, road land, road safety corridors, and auxiliary facilities serving road transport activities."
What is a road safety corridor?,"A road safety corridor is a strip of land along both sides of road land, extending from the outer edge of the land designated for road protection and maintenance outward, to ensure road traffic safety, visibility for vehicles, and to minimize environmental impact."
What is a road management authority?,"A road management authority is an agency under the Ministry of Transport that assists the Minister of Transport in performing state management functions related to road transport activities; it also includes specialized agencies under provincial and district-level People's Committees, as well as communal People's Committees."
Who are road managers and users?,"Road managers and users are direct owners responsible for managing, using, operating, and exploiting road structures, or organizations and individuals assigned to manage, use, operate, and exploit road structures."
What are the principles of road transport activities?,"The principles of road transport activities include ensuring smooth, safe, synchronized, efficient, and environmentally friendly traffic, meeting the needs of freight transport and convenient travel for people, contributing to socio-economic development, national defense, security, environmental protection, disaster prevention, and international integration."
What factors must road transport activities ensure?,"Road transport activities must ensure smooth, safe, synchronized, efficient, and environmentally friendly traffic, meeting the needs of freight transport and convenient travel for people."
Why is it necessary to develop road transport according to planning?,"Developing road transport according to planning helps efficiently utilize resources, connect road transport with other modes of transportation, enhance the application of advanced science and technology, and ensure modernization and synchronization."
How is the assignment of responsibilities in road transport activities implemented?,"The assignment of responsibilities in road transport activities is carried out uniformly based on specific task and authority delegation, while ensuring close coordination between ministries, sectors, and local authorities at all levels."
How should violations of road transport laws be handled?,"All violations of road transport laws must be promptly detected, prevented, and strictly handled in accordance with the law."
Why is it necessary to connect road transport with other modes of transportation?,"Connecting road transport with other modes of transportation increases transport efficiency, optimizes traffic infrastructure, and ensures effective resource utilization."
Why is the application of science and technology important in road transport development?,"The application of science and technology in road transport development ensures modernization, synchronization, and enhances the efficiency of traffic management and operations."
What does the policy for road infrastructure development include?,"The policy for road infrastructure development includes focusing resources on developing modern infrastructure, synchronizing connections with other routes; establishing mechanisms to mobilize social resources; prioritizing the development of highways, regional and urban connection roads, and roads serving national defense and security purposes."
How can social resources be mobilized for road infrastructure development?,"Social resources can be mobilized through investment incentive mechanisms, diversifying investment, construction, management, operation, and maintenance methods for road infrastructure."
What types of road infrastructure are prioritized for development?,"Priority is given to developing highways, regional and urban connection roads, infrastructure in ethnic minority areas, mountainous regions, islands, border areas, and urban roads to reduce traffic congestion."
What are the key aspects of the road transport development policy?,"The road transport development policy includes rationally developing transport business models, creating a healthy competitive environment, promoting smart transportation, and prioritizing public passenger transport."
Why is it necessary to prioritize public passenger transport?,"Prioritizing public passenger transport helps reduce traffic congestion, lower environmental pollution, and improve urban transport efficiency."
How can investment in road infrastructure and transport be encouraged?,Investment can be encouraged by creating favorable conditions for domestic and foreign organizations and individuals to participate in investment and operation of road infrastructure and transport services.
What is the role of science and technology in road transport development?,"Science and technology play a crucial role in researching and applying advanced technologies, using sustainable and environmentally friendly materials, and enhancing human resource training in the road transport sector."
What is the national road network planning?,The national road network planning is a sectoral national plan that determines the development direction and spatial organization of the national highway system. It serves as a basis for infrastructure planning and road network development.
What principles must be followed when formulating road network planning?,"The formulation, appraisal, approval, and adjustment of road network planning must comply with legal regulations on planning and ensure the connection of road transport with other transport modes."
Who is responsible for organizing the planning of the road network?,The Ministry of Transport is responsible for organizing the planning of the road network and submitting it to the Prime Minister for approval.
What is road infrastructure planning?,Road infrastructure planning is a technical and specialized plan that concretizes the road network planning by determining the development plans for road works and other infrastructure along each road route.
What are the key contents of road infrastructure planning?,"Road infrastructure planning includes determining the basic route direction, key control points, route length, scale through each locality and region, preliminary scale of bridges, tunnels, ferry terminals, main intersections, and connection plans with other transport modes, urban systems, economic zones, and industrial zones."
How often is road infrastructure planning reviewed?,Road infrastructure planning is reviewed every 5 years to ensure it aligns with socio-economic development conditions in each period and is publicly announced.
What is the planning period for road infrastructure?,"The planning period for road infrastructure is 10 years, with a vision of 20 to 30 years."
What is the role of provincial authorities in road development planning?,"Provincial People's Committees organize the development of road network content in the traffic network planning, ensuring compliance with legal regulations on planning and other relevant laws."
What must be ensured in road network planning?,"Road network planning must ensure the connection of road transport between urban areas, regions, and bus stations, as well as the effective integration of different transport modes, connecting roads to international border gates, main border gates, railway stations, airports, seaports, inland ports, and dry ports."
Who regulates the detailed content and procedures of road infrastructure planning?,"The Government regulates the detailed content, procedures, and processes for formulating, appraising, approving, and adjusting road infrastructure planning."
What is the national road network planning?,The national road network planning is a sectoral national plan that determines the development direction and spatial organization of the national highway system. It serves as a basis for infrastructure planning and road network development.
What principles must be followed when formulating road network planning?,"The formulation, appraisal, approval, and adjustment of road network planning must comply with legal regulations on planning and ensure the connection of road transport with other transport modes."
Who is responsible for organizing the planning of the road network?,The Ministry of Transport is responsible for organizing the planning of the road network and submitting it to the Prime Minister for approval.
What is road infrastructure planning?,Road infrastructure planning is a technical and specialized plan that concretizes the road network planning by determining the development plans for road works and other infrastructure along each road route.
What are the key contents of road infrastructure planning?,"Road infrastructure planning includes determining the basic route direction, key control points, route length, scale through each locality and region, preliminary scale of bridges, tunnels, ferry terminals, main intersections, and connection plans with other transport modes, urban systems, economic zones, and industrial zones."
How often is road infrastructure planning reviewed?,Road infrastructure planning is reviewed every 5 years to ensure it aligns with socio-economic development conditions in each period and is publicly announced.
What is the planning period for road infrastructure?,"The planning period for road infrastructure is 10 years, with a vision of 20 to 30 years."
What is the role of provincial authorities in road development planning?,"Provincial People's Committees organize the development of road network content in the traffic network planning, ensuring compliance with legal regulations on planning and other relevant laws."
What must be ensured in road network planning?,"Road network planning must ensure the connection of road transport between urban areas, regions, and bus stations, as well as the effective integration of different transport modes, connecting roads to international border gates, main border gates, railway stations, airports, seaports, inland ports, and dry ports."
Who regulates the detailed content and procedures of road infrastructure planning?,"The Government regulates the detailed content, procedures, and processes for formulating, appraising, approving, and adjusting road infrastructure planning."
What is the road database?,"The road database is designed, built, and operated according to the national digital architecture framework. It includes data on road network planning, infrastructure planning, investment status, electronic toll collection, and transport activities, excluding vehicle journey data, driver images, and driver working hours management data."
What does the road database include?,"The road database includes data on road network planning, infrastructure investment and construction, operational infrastructure, electronic toll collection, and transport activities excluding certain restricted data as per legal regulations."
How is the road database connected?,"The road database is connected and shared with databases on road traffic order and safety, as well as other relevant databases."
Who regulates the management and use of the road database?,"The Government details the provisions on road database management, data collection, exploitation, and sharing."
What is the road database?,"The road database is designed, built, and operated according to the national digital architecture framework. It includes data on road network planning, infrastructure planning, investment status, electronic toll collection, and transport activities, excluding vehicle journey data, driver images, and driver working hours management data."
What does the road database include?,"The road database includes data on road network planning, infrastructure investment and construction, operational infrastructure, electronic toll collection, and transport activities excluding certain restricted data as per legal regulations."
How is the road database connected?,"The road database is connected and shared with databases on road traffic order and safety, as well as other relevant databases."
Who regulates the management and use of the road database?,"The Government details the provisions on road database management, data collection, exploitation, and sharing."
What are the classifications of roads based on management level?,"Roads based on management level include national highways, provincial roads, district roads, commune roads, village roads, urban roads, and dedicated roads."
What is a national highway?,"A national highway connects Hanoi with provincial administrative centers, links provincial administrative centers, and plays an important role in economic, social development, national defense, and regional security."
What is a provincial road?,A provincial road is a road within a province that connects the provincial administrative center with district administrative centers and is significant for the province's socio-economic development.
What is a district road?,"A district road connects the district administrative center with commune administrative centers, commune clusters, or adjacent district centers and is important for district socio-economic development."
What is a commune road?,"A commune road connects the commune administrative center with villages and rural residential areas or links neighboring communes, playing a key role in local economic and social development."
What is a village road?,"A village road exists within a village, connecting residential areas with agricultural, forestry production sites, and other business facilities within the village."
What is an urban road?,"An urban road is located within the administrative boundaries of cities and towns, including expressways, streets, alleys, and narrow paths within urban areas."
What is a dedicated road?,"A dedicated road serves the transportation needs of specific organizations, agencies, or individuals, including private internal roads."
What roads are classified as local roads?,"Local roads include provincial roads, urban roads, district roads, commune roads, and village roads."
Who is responsible for managing national highways?,"The Ministry of Transport is responsible for managing national highways, except for cases assigned to provincial authorities."
Who is responsible for managing local roads?,"Provincial People's Committees manage provincial roads, certain national highways passing through special urban areas, and other roads as assigned."
Who is responsible for managing dedicated roads?,Individuals or organizations using dedicated roads are responsible for their management in compliance with the law.
Who provides detailed regulations on road classification management?,"The Government provides detailed regulations on road classification, management, and administration."
How are roads classified by function?,"Roads are classified into main roads, branch roads, frontage roads, service roads, public roads, internal roads, and dedicated lanes for pedestrians and cyclists."
What is a main road?,A main road primarily serves traffic within a region and connects different areas and zones.
What is a branch road?,A branch road connects to a main road and serves as a link between areas on both sides of the main road or between service roads and the main road via intersections.
What is a frontage road?,"A frontage road collects traffic from internal roads within urban, industrial, economic, residential, and commercial-service areas before connecting to a main or branch road."
What is a service road?,"A service road runs parallel to a main road, separating regional traffic from the main road, either by physical barriers such as dividers, walls, or fences."
What is a public road?,A public road is accessible to all people and vehicles under the laws governing road transport.
What is an internal road?,"An internal road is located within residential, urban, industrial, economic, commercial-service areas, or institutions and is only accessible to authorized individuals."
What are dedicated lanes?,"Dedicated lanes are specific roads or paths reserved for pedestrians, cyclists, or other designated users."
What is the technical classification of roads?,The technical classification of roads must be determined in road construction investment projects and must comply with approved regulations and technical standards.
How is the technical classification of roads regulated?,"It is defined in national technical standards and road design standards, including expressways, different road grades, and urban roads."
What are the different technical grades of roads?,"Roads are classified into expressways, Grade I to VI roads, urban roads, and other graded roads such as A, B, C, and D."
Who regulates the technical classification of roads?,"The Minister of Transport issues national technical regulations for expressways and graded roads, while the Minister of Construction regulates urban roads."
How are road names assigned?,"Roads are named after historical figures, landmarks, cultural events, or local customs."
How are road numbers assigned?,"Road numbers are assigned using natural numbers, sometimes with additional letters if necessary."
What happens when an urban road overlaps with another road?,"In such cases, both the urban road name and the name/number of the overlapping road are used."
How are international roads named and numbered?,International roads follow naming conventions based on agreements between Vietnam and relevant international organizations or countries.
What happens when multiple roads overlap?,"The road with the higher administrative management level retains its name and number, except for special cases defined in regulations."
Are all roads required to have names and numbers?,"No, commune roads, village roads, internal roads, and dedicated roads are not required to have names or numbers."
Are internal roads required to be named?,"No, internal roads in residential areas, industrial zones, and commercial areas are not required to be named."
When is renaming a road necessary?,A road may be renamed if there are changes in administrative boundaries or under special government decisions.
Do village roads need official road numbers?,"No, village roads do not require official road numbers unless deemed necessary by local authorities."
Who has the authority to rename roads?,The government and relevant authorities regulate road naming and renaming policies.
What must land for road infrastructure comply with?,"Land for road infrastructure must comply with the national road network plan, provincial and district land-use plans, and related planning documents."
How is land for road infrastructure in urban areas classified?,It is considered a part of transportation land within the total land allocated for urban construction.
What percentage of urban construction land should be allocated for transportation?,"The percentage should range from 11% to 26%, depending on urban infrastructure development standards and landscape planning."
How does the percentage vary for special urban areas?,"For special urban areas designated by the National Assembly Standing Committee, the transportation land ratio must be at least 50% of the standard percentage."
Why is transportation land allocation important?,"It ensures proper urban planning, supports infrastructure development, and maintains efficient traffic flow."
What factors influence the percentage of transportation land?,"Factors include urban classification, infrastructure development, and legal regulations on urban planning."
What happens if an urban area does not meet the required transportation land ratio?,Authorities may require adjustments in land-use plans to comply with legal standards and urban development goals.
What is included in land for road infrastructure?,"It includes land for roads, transport facilities like bus stations and rest stops, and road safety corridors."
What are the main components of road land?,"Road land consists of land for road construction and maintenance, as well as land to protect and sustain road operations."
What facilities can be built on road infrastructure land?,"Bus stations, parking lots, rest stops, and auxiliary structures for road services."
How should land for road infrastructure be managed?,"It must comply with regulations on land use, urban planning, and transportation laws."
What is a road safety corridor?,A designated area along roads to ensure safety and prevent encroachments.
Why is land allocation for road infrastructure important?,"It ensures smooth transportation, road safety, and space for essential facilities."
What should property owners do if road drainage affects their land?,"They must allow proper drainage without obstruction, and any damages must be compensated."
Who is responsible for road drainage management?,The road management authority must minimize damage to private properties and compensate if necessary.
How is maintenance land determined for embankment roads?,It extends outward from the bottom of the embankment slope.
How is maintenance land determined for excavated roads?,It is measured from the outermost edge of the drainage trench or slope top.
What is the rule for maintenance land around bridges and tunnels?,It extends from the outermost structural component to ensure stability and access.
How is maintenance land determined for urban roads?,"It uses sidewalk space if available, otherwise part of the road is allocated for maintenance."
What happens when road maintenance land overlaps with railways?,It must not affect railway operations and safety regulations apply.
What is the principle for overlapping road maintenance land?,The road with a higher technical classification takes priority.
How is maintenance land determined for ferry terminals?,It includes land from the road leading to the terminal and surrounding infrastructure.
What happens when road maintenance land overlaps with dikes?,"The land must not compromise flood protection, and solutions must be implemented if needed."
How is maintenance land managed near urban structures?,Boundaries are defined based on existing road elements like sidewalks or fences.
What is the standard for maintenance land width in non-urban areas?,It depends on road classification and must allow space for drainage and repairs.
How is maintenance land allocated for underground tunnels?,"It extends from tunnel entrances, ventilation shafts, and emergency exits."
