question,answer
"Recently, ambulance is carrying serious patients in critical condition from Tuyen Quang to Viet Duc Hospital, Hanoi for emergency treatment.On the way, a truck appeared continuously, refusing to give way to ambulance (although the ambulance continuously signaled the siren).This behavior causes great pressing in public opinion.The Ministry of Public Security asked me, how will the act of not giving way to ambulance will be handled?In what extent, the violation is examined for penal liability?","1. The priority of the ambulance is specified at Point c, Clause 1, Article 22 of the 2008 Road Traffic Law, whereby the ambulance is performing the emergency task with the priority the priority of other vehicles when crossing the intersection from any direction.When the signal of the vehicle is prioritized, traffic participants must quickly slow down, avoid or stop close to the right side of the road to give way, not to hinder the vehicle with the priority.
2. Pursuant to Article 3, Article 8, Article 15 of the Government's Decree 109/ND-CP dated December 1, 2009, stipulating the signal of the vehicle with priority;Article 4 of Joint Circular No. 04/2012/TTLT-BCA-BCT dated March 8, 2012 of the Ministry of Public Security and the Ministry of Industry and Trade stipulating that the vehicle's signal device is prioritized, the ambulance is entitled to priority when ensuring the following requirements: currently carrying out emergency tasks (carrying emergency patients or taking emergency patients), which must be installed and have a license to use the vehicle with the right to use the vehicle with the right to use the vehicle.grant.
3. For acts of not giving way to the vehicle with the priority, it is giving priority signals to go on duty: Based on the provisions of Point h, Clause 5, Article 5;Point b, Clause 11, Article 5 of Decree No. 100/2019/ND-CP dated December 30, 2019, stipulating sanctioning administrative violations in the field of road and rail transport will be fined from 3,000,000 VND to 5,000,000 VND and deprived of the right to use the driving license from 01 to 03 months.
Therefore, in order to sanction administrative violations for drivers of truck vehicles as in the above case, the following factors must be identified: The ambulance has a license to use the signal transmission device of the vehicle with the priority (the ambulance is legal operation), is on emergency duty, is using priority signals (whistle, priority lights) and proves the act of intentionally not the vehicle of the driver.
4. In order to investigate the criminal liability for this act, it is necessary to base on many details and factors and must be intentional acts, causing particularly serious consequences according to the verification survey results of the Investigation Police Agency and Procuracy."
"Currently, the situation of the car causing the accident that the vehicle is not owned by the driver quite a lot;Mainly cars of transport business companies hire drivers.The Ministry of Public Security asked, according to the current regulations, the owner of the vehicle, the head of the transport business unit with drivers and vehicles causing serious traffic accidents will be responsible?In case of how, the criminal prosecution is examined?","Pursuant to Article 601 of the 2015 Civil Code, the means of transport is a high source of danger, whereby the owner of the high -level danger source is possessing and using the height of the height, it is necessary to compensate for damage caused by the height of danger;If the owner has given to others to possess or use, this person must pay compensation, except for other agreements.The owner, the person who possesses and uses the source of danger to compensate the damage both when there is no fault, unless the damage occurs completely due to the intentional fault of the victim or the damage occurs in the case of force majeure or urgent situation, unless otherwise prescribed by law.
Depending on the specific case, the owner of the vehicle, the head of the transport business unit with drivers and vehicles causing traffic accidents will be examined for penal liability as prescribed in Articles 263, 264 of the Penal Code 2015."
"Recently, the public was very urgent because the incident of the couple helped people having traffic accidents in Van Don, Quang Ninh but were accused of being an accident.Regarding this, the Ministry of Public Security let me ask some of the following:
- If after helping people who have a traffic accident but are accused of being an accident, what do the helpers themselves do?What solutions do the police have to avoid wrongdoing in cases like this?
- In case of seeing a person in a traffic accident without helping, how will it be handled?","- Regarding the content, ""If after helping people who have a traffic accident but is accused of being an accident, what does the help himself do?What solutions do the police have to avoid wrongdoing in cases like this?""
Article 38 of the 2008 Road Traffic Law stipulates the responsibilities of individuals, agencies and organizations when the traffic accident occurs as follows:
“(1) The driver of the vehicle and the people involved directly on the following responsible accident: a) Stop the vehicle immediately;maintain the scene;emergency person in victims and must be present when competent authorities require;b) Staying at the occurrence of the accident until the police of the police arrived, unless the driver was also injured, he had to take them to emergency or had to take the victim to emergency or for life -threatening reasons, but to report to the nearest police office;c) Provide authentic information about the accident to the competent authority.
(2) The people present at the place where the accident happens: a) Protect the scene;b) Help and promptly treat victims;c) To immediately report to the nearest police, health or People's Committee;d) Protect the property of the victim;d) Provide authentic information about the accident at the request of the competent authority.
(3) The driver of other vehicles when passing the occurrence of the accident is responsible for transporting the victim to emergency.The vehicles are given priority, vehicles carrying people are entitled to preferential, diplomatic exemptions and consulars that are not required to implement the provisions of this Clause.
(4) The police agency receives the news about the accident that is responsible for sending people to the scene immediately to investigate the accident, coordinate with the road management agency and the local People's Committee to ensure smooth and safe traffic ... ""
Thus, based on the above provisions, the driver of the vehicle and those involved directly on the accident or the person present at the place where the traffic accident must immediately report the information of the traffic accident to the police office, health agency or the nearest People's Committee, and are responsible for coordinating the provision of authentic information about the traffic accident to the traffic accident.Regarding the accident, he was responsible for sending people to the scene to investigate the accident.
The investigation and settlement of traffic accidents of the police agency shall be conducted in accordance with the law and regulations of the Ministry of Public Security on the investigation and settlement of traffic accidents.In the process of investigating, verifying and resolving traffic accidents and detecting people who have slandered others for bad purposes, based on the level of causing the consequences of violations to conduct handling in accordance with law.
- Regarding the content, ""If you see a traffic accident without helping, how will it be handled according to the regulations?""
Clause 18, Article 8 and Article 38 of the 2008 Road Traffic Law stipulates the help of people in traffic accidents.Based on the specific level of causing damage of violations to help people in traffic accidents to handle as follows:
+ A fine of from VND 500,000 to VND 1 million for individuals, from VND 1-2 million for organizations that do not save people in traffic accidents when required (Point a, Clause 7, Article 11 of Decree 100/2019/ND-CP).
+ Not saving people who are in life -threatening state can also be handled according to criminal law (Article 132 of the 2015 Penal Code amended and supplemented in 2017 providing for not saving people in a life -threatening state)."
"I went to participate in traffic on the road, saw many cases of cars carrying 02 license plates (at this sea, when overturning the sea) to evade the control of the authorities.The Ministry of Public Security asked me, in case of using fake license plates to participate in traffic if discovered how will it be handled?","On December 30, 2019, the Government issued Decree No. 100/2019/ND-CP on sanctioning administrative violations in the field of road and rail transport;In particular, at Point d, Clause 5, Article 16 stipulates: ""A fine of between VND 4,000,000 and VND 6,000,000 shall be imposed for acts of controlling a license plate with a license plate that is not in accordance with the vehicle registration certificate or the number plate is not issued by the competent authority (including trailers and trailers).

At Point c, Clause 6, Article 16 stipulates: “In addition to being fined, the driver of the vehicle performs the acts specified at Point d, Point d, Clause 5 of this Article is confiscated the certificate, technical safety inspection stamps and environmental protection, vehicle registration certificates, license plates in contravention of regulations or being erased;Be deprived of the right to use the driver's license from 01 month to 03 months. ”

Thus, in case the driver of a car is attached to the license plate, which is not in accordance with the vehicle registration certificate or the number plate is not issued by the competent authority to participate in traffic, it will be fined from VND 4,000,000 to VND 6,000,000;confiscated number plates in contravention of regulations;Being deprived of the right to use the driving license from 01 month to 03 months."
"Recently, I was carrying goods by motorbike, while circulating when the traffic police stopped the vehicle due to bulky cargo violations, lack of vehicle registration and into the forbidden road.After that, I was administratively sanctioned and kept by a vehicle with a 30 -day driver's license, so far over 06 months but I have not paid a fine to get back the vehicle and license.I want to ask the Ministry of Public Security, now I have to pay a fine, can I receive a vehicle and a driver's license?If not, what procedures do I have to do to get the vehicle and license?","Clause 1, Article 73 of the 2012 Law on Handling of Administrative Violations: “Individuals and organizations that are sanctioned for administrative violations must comply with the sanctioning decision within 10 days from the date of receiving the decision on sanctioning administrative violations;In case the decision on sanctioning administrative violations shall be recorded for more than 10 days, shall be implemented according to that time limit ”.
Clause 1, Article 78 of the 2012 Law on Handling of Administrative Violations stipulates: “Within 10 days from the date of receiving the sanctioning decision, the sanctioned individual or organization must pay a fine at the State Treasury or submit it to the State Treasury's account stated in the sanctioning decision, except for the case that has paid the fine specified in Clauses 2 and 3 of this Article.If past the above time limit, it will be enforced to enforce the sanctioning decision and every day of delayed fines, individuals and organizations of violations must pay an additional 0.05% of the total amount of unpaid fines ”.
Clause 4, Article 126 of the 2012 Law on Handling of Administrative Violations stipulates: “For material evidences and means of administrative violations beyond the custody time limit if the violator does not come to receive without plausible reasons or in case the violator cannot be determined, the person who makes the temporary detention decision must notify on the mass media and publicly listed at the headquartersWithin 30 days from the date of notice and public listing, if the violator does not come to receive it, the competent person must issue a decision to confiscate material evidences and means of administrative violations for handling in accordance with Article 82 of this Law. ""
Proposing Nguyen Quang Hung to go to the agency of the person competent to sanction administrative violations for guidance."
"I know, according to the regulations, people who are full 16 years or older can drive a motorbike with a cylinder capacity of less than 50 cm3.I would like to ask the Ministry of Public Security, in case the person who is under 16 years old drives a motorbike with a cylinder capacity of less than 50 cm3 without wearing a helmet, wriggling hammock causing collision with other vehicles participating in traffic, how is it sanctioned?In addition, the owner of a motorbike for a person who is under 16 years old borrowed a car was punished?","Point a, Clause 1, Article 5 and Clause 3, Article 134 of the Law on Handling of Administrative Violations stipulates: People from 14 years old to 16 years old are administratively sanctioned on administrative violations due to intentional.In case a person from full 14 years old to under 16 years of age violates administrative violations, the fine is not applied.
Article 22 of the Law on Handling of Administrative Violations stipulates: Warning applied ... For all administrative violations by minors from full 14 years old to under 16 years old ... Article 21 of the Government's Decree No. 100/2019/ND-CP of December 30, 2019 on sanctioning administrative violations in the field of road and railway traffic stipulating: Warning of people from 14 years old, motorbikes, including motorbikes, including motorcycles, including motorcycles, including motorcycles, including motorcycles, including motorcycles, including motorcycles, including motorcycles, including motorcycles, including motorcycles)Motorcycle.
Thus, the case from full 14 years old to under 16 years old driving a motorbike with a cylinder capacity of less than 50 cm3 without wearing a helmet, wriggling hammock causes collision with other vehicles as readers ask, based on the above regulations, the warning is sanctioned in writing.
For vehicle owners to hand over to people from full 14 years old to under 16 years of age, based on Point dd, Clause 5, Article 30 of the Government's Decree No. 100/2019/ND-CP of December 30, 2019, on sanctioning administrative violations in the road transport sector, they will be fined from VND 800,000 to VND 2,000,000 (if individual) and a fine of between VND 1,600,000 to VND 4,000,000 (if organized)."
"Proposing the Ministry of Public Security to promulgate the Regulation on operational regulations on functions and tasks to create the initiative for the traffic police force, district and district order in patrol and handling of cases of violations to stop and pick up passengers in the wrong places, affecting traffic order and safety;Building a system of information linkages on violations of traffic police forces to update information of violations of administrative violations.","In this regard, the Ministry of Public Security answered as follows:

- Regarding the functions, tasks, powers to patrol and control the handling of violations of traffic order and safety (traffic safety) of the traffic police (traffic police) specified in Circular No. 65/2020/TT-BCA dated June 19, 2020 of the Minister of Public Security.Accordingly, the district -level police police are responsible for patrolling and controlling (TTKS) to ensure the road traffic safety and safety within the area and localities assigned (Clause 2, Article 6);Detecting and promptly preventing and strictly handling violations of road traffic safety and other violations as prescribed by law, including violations of stopping and returning passengers at the prescribed places as recommended by voters.

- For recommendations on the construction of the information linkage system in the traffic police for sanctioning of violations to update the violation information of administrative violations: The Ministry of Public Security has built and deployed a database system to handle violations, and connect and share driving license data, look up violating transport vehicles through the image on the image on the website of CSGT.vn.All relevant people and agencies and organizations can visit this website to look up information on violations and the results of handling administrative violations on traffic safety.In addition, implementing the Prime Minister's Decision No. 274/QD-TTg of March 12, 2019, approving the National Public Service Portal in the People's Public Security Forces, from July 1, 2020, the Ministry of Public Security has implemented synchronously to the traffic police departments of 63 provinces and cities directly under the Central Government, proceeding to deploy to the district police nationwide.

In order to improve the efficiency of state management, and at the same time meet the requirements of the e -government in the field of traffic safety and safety, the Ministry of Public Security is researching and building a shared database on traffic safety, including data handling administrative violations to share with ministries and branches serving traffic safety assurance."
"Recently, there were a number of drivers after causing a traffic accident, taking advantage of the deserted road that drove away to wear victims at the scene.I want to ask the Ministry of Public Security, how will the act of fleeing the driver after causing a traffic accident will be handled?In case of escape and causing injury to what percentage will be examined for penal liability?If the victim has an application for a complaint, how will the driver cause an accident?","* In Clause 17, Article 8 of the 2008 Road Traffic Law stipulates: It is strictly forbidden to escape after causing an accident to evade responsibility.

* In the Government's Decree No. 100/2019/ND-CP of December 30, 2019, on sanctioning administrative violations in the field of road and railway traffic, the driver of the vehicle commits the act of ""causing traffic accidents does not stop, does not keep the scene, fled without reporting to the competent authority, does not participate in the emergency of the victim"" being sanctioned as follows:

- For drivers of cars and vehicles similar to cars: a fine of between VND 16,000,000 and VND 18,000,000;Deprivation of the right to use the driving license from 05 months to 07 months.

- For motorcyclists and motorbikes (including electric motorbikes), vehicles similar to motorcycles and similar vehicles: a fine of between VND 6,000,000 and VND 8,000,000;Deprivation of the right to use the driver's license from 03 months to 5 months.

- For operators of tractors and special -use motorbikes: A fine of between VND 10,000,000 and VND 12,000,000;Deprivation of the right to use the driving license (when controlling the tractor), the certificate of fostering legal knowledge on road traffic (when driving a special -use motorbike) from 05 months to 07 months.

- For drivers of bicycles, engine bicycles (including electric bicycles), other rudimentary drivers: a fine of between VND 400,000 and VND 600,000.

* Regarding cases of criminal liability, Article 260 of the 2015 Penal Code (amended and supplemented in 2017) specifies ""Crime of violating regulations on road traffic"" as follows:

""1. Those who participate in road traffic that violate the regulations on road traffic safety belonging to one of the following cases are fined from VND 30,000,000 to VND 100,000,000, non -custodial reform for up to 03 years or prison terms from 01 year to 5 years:

a) Deading 01 person or causing injury or harm to the health of 01 person with the body damage rate 61% or more;

b) Causing injury or harm to the health of 02 people with the rate of body damage of each person from 31% to 60%;

c) Causing injury or harm to health for 03 people or more, the total rate of body damage of these people is from 61% to 121%;

d) Causing property damage from VND 100,000,000 to under VND 500,000,000.

2. The crime belongs to one of the following cases, the imprisonment is from 03 years to 10 years:

a) There is no driving license as prescribed;

b) In the state of using alcohol, beer, in the blood or breath, there is alcohol content in excess of the prescribed level or the use of narcotic substances or other strong stimulants that the law banned from use;

c) Causing accidents and then running away to avoid responsibility or intentionally not to save the victims;

d) Failing to obey the command of the driver or traffic guidance;

d) killing 02 people;

e) Causing injury or harm to the health of 02 people with the rate of body damage of each person 61% or more;

g) Causing injury or harm to the health of 03 people or more, the total number of body damage of these people is from 122% to 200%;

h) Causing property damage from VND 500,000,000 to under VND 1,500,000,000.

3. The crime belongs to one of the following schools, the imprisonment is from 07 years to 15 years:

a) Death 03 people or more;

b) Causing injury or harm to the health of 03 people with the rate of body damage of each person 61% or more;

c) Causing injury or harm to the health of 03 or more people with the total rate of body damage of these people 201% or more;

d) Causing property damage of VND 1,500,000,000 or more.

4. Road roads that violate the regulations on road traffic safety causing injury or harm to the health of 01 person with the body damage rate of between 31% to 60% or cause injury or damage to the health of 02 or more people with the total rate of body damage of these people from 31% to 60%, the fine is from 30,000,000 VND to 100,000,000 VND or improved by 03 years.

5. Violation of regulations on road traffic safety that has the actual ability to lead to damage to the life, health or property of others if not prevented in time, shall be fined from VND 10,000,000 to VND 50,000,000, non -custodial reform for up to 01 year or a prison term of between 03 months to 01 year.

6. Offenders may also be banned from taking on positions, banned from practicing or doing certain jobs from 01 year to 05 years. ""

In case the victim has an application for a complaint but the driver causes an accident with signs of crime, he is still examined for penal liability in accordance with the law."
Proposing the Ministry of Public Security to promulgate the Regulation on coordination and specific responsibilities among the traffic police teams of the Road and Railway Traffic Police Department and the forces of the District Police in the patrol and control of violations in the management area.,"In this regard, the Ministry of Public Security answered as follows:

- According to Point d, Clause 1 and Point d, Clause 2, Article 6 of Circular No. 65/2020/TT -BCA of June 19, 2020 of the Minister of Public Security, defining the tasks, powers, forms, content and process of patrol, control and handling of administrative violations on road traffic police stipulating: ""In case of necessity, the traffic police department, the road police department, the traffic police department(collectively referred to as the Traffic Police Department) Organizing the implementation force or presiding over and coordinating with the police, districts, towns and cities directly under the provinces and cities under the Central Government (collectively referred to as district -level police), relevant forces implementing the plan of patrol and control on road traffic routes according to the plan of the provincial police director, the head of the traffic police department.The district -level police coordinated with the Traffic Police Department to patrol, control and handle violations on road traffic routes within the administrative boundaries according to the plan of the Director of the provincial Police, the Head of the Traffic Police Department ”.

- In addition, Article 13 of the Minister of Public Security's Circular No. 32/2018/TT-BCA dated October 8, 2018 defining the order and contents of inspection, control and handling of administrative violations in the field of railway traffic of the Traffic Police forces stipulating: ""District-level police in coordination with the Traffic Police Department inspects, controls and handes administrative violations in the field of railway transport as planned by the provincial police.""

The coordination of patrol and control of administrative violations in the field of traffic order and safety of the Traffic Police Department with the district police has been strictly implemented, in accordance with the law, without overlapping and difficulties in the coordination process, so it is not necessary to issue coordination regulations."
