question,answer
"The Taxi Association of Hanoi, Ho Chi Minh City and Da Nang proposes to change the number plates yellow, letters and black numbers for all transport business vehicles.","In this regard, the Ministry of Public Security answered as follows:
1. Pursuant to Article 4, 13, 17, Article 20 of the Government's Decree No. 86/2014/ND-CP of September 10, 2014, on the conditions of transport business by car and Article 4, Article 6, Article 37, Article 54 of Circular No. 63/2014/TT-BGTVT dated November 7, 2014 of the Ministry of Transport, regulating the organization and management of transport activities by car and services support services.In which, regulations for passenger transport business by taxi, in addition to meeting the conditions of transport business by car, also the following conditions:
- List the two sides of the car door: Name, phone number and logo (logo) of businesses and cooperatives.
- There are taxi badges;The light box with the word ""Taxi"" is mounted on the roof of the car, the light box is on the car when there is no passenger and turn off when the car has a passenger.
- The charging clock has been tested and lead by the competent authority.
Thus, at present, the management of vehicles by car in general and the passenger transport business means by taxi in particular, the documents of the Government and the Ministry of Transport have been very complete and specific;Transport business must have badges issued by competent agencies, serving the inspection and supervision of transport business activities of functional forces and people;ensure strict management, and customers when using the service can identify vehicles and businesses to choose to use the appropriate service.
2. The proposal to change color number plates of transport business vehicles of the Taxi Association of Hanoi, Da Nang and Ho Chi Minh City.Ho Chi Minh has not received the consensus of society and people;more administrative procedures for state management agencies, wasting people's time and money.Not suitable for the implementation of the policy of reforming administrative procedures under the direction of the Government, causing trouble for the people.
3. In Circular No. 20/2010/TT-BGTVT dated July 30, 2010 of the Ministry of Transport, stipulating the grant, exchange, recovery of registration and number plate of special-use motorbikes with road traffic;""The license plate yellow, text and black numbers"" are being used by the transport industry to register and issue a number plate for special -use motorcycles.
Therefore, the content of the Taxi Association of Hanoi, Da Nang and Ho Chi Minh City.Ho Chi Minh asked the Ministry of Public Security to amend and supplement the Circular No. 15/2014/TT-BCA regulating the vehicle registration: For all transport business vehicles that stipulate yellow plates, letters and black numbers are not consistent with the current law provisions, social consensus and policy of administrative procedure reform of the Party and State."
"Recently, I participated in traffic on the road using headphones to listen to music and have been punished by traffic police using umbrellas (umbrellas), mobile phones, audio equipment when driving motorbikes and motorbikes.I want to ask more about the penalty for the person who is driving a motorbike using headphones to listen to music and which error is this document?","At Point o Clause 3, Article 6 of Decree No. 46/2016/ND-CP dated May 26, 2016 of the Government stipulating sanctions on administrative violations in the field of road and railway traffic, clearly stating the regulations on sanctioning operators, people sitting on motorcycles, motorbikes (including electric motorbikes), vehicles similar to motorcycles and vehicles similar to motorbike violations of road traffic rules from VND 100,000 to VND 200,000 to VND 200,000 for people using VND 200,000 to VND 200,000 for people who are using VND 200,000 to VND 200,000 for people who are using VND 200,000 for people who are using VND 200,000 for people who are using VND 200,000 for people who are using VND 200,000 VND(parachute), mobile phones, audio equipment, except for hearing aids."
"I violated the red light and was punished by the traffic police.I have proposed to pay a fine on the spot to continue circulating because there is a very hurry but the traffic police disagree.I want to ask, which traffic violations are paid by the fine?","- According to Clause 1, Article 56 of the Law on Handling of Administrative Violations: “Sanctioning of administrative violations does not make a record applied in case of a warning or a fine of up to VND 250,000 for individuals and VND 500,000 for sanctioning organizations and people who have to issue a decision on sanctioning on -spot administrative violations.In case of administrative violations, it is detected by the use of technical and professional equipment and equipment, the record must be made. ”

- With the violation that citizens presented ""cross the red light"", is a violation that does not obey the order of traffic lights as prescribed in the Government's Decree No. 46/2016/ND-CP dated May 26, 2016, stipulating sanctions on administrative violations in the field of road and railway traffic, specifically:
+ At Point c, Clause 4, Article 6 for vehicles is a motorbike: a fine of from VND 300,000 to VND 400,000.
+ At Point a, Clause 5, Article 5 for vehicles is a car: a fine of between VND 1,200,000 to VND 2,000,000.

Based on the above provisions, citizens' violations must make a record of administrative violations and implement the order of handling violations in accordance with law."
"I am participating in traffic on the right road, my lane and absolutely the speed of permission, but suddenly a person crashed into my car quite strongly and died.I want to ask, do I have to pay damages in this case?","Pursuant to Clause 4, Article 38 of the 2008 Road Traffic Law stipulates: ""When the police agency receives the news about the responsible accident, sending people to the scene immediately to investigate the accident, coordinate with the road management agency and the local People's Committee to ensure smooth and safe traffic.""Therefore, the investigation of traffic accident settlement is the investigation activities conducted by the People's Police force in accordance with the law, in order to detect and collect all relevant evidence and documents to determine the developments, causes and conditions of traffic accidents.At the same time, dealing with acts of causing traffic accidents (administrative handling if the act of a traffic accident does not show signs of crime or criminal handling if the act of a traffic accident has sufficient signs of criminals) in accordance with the law.

The law does not specify the police authorities with civil settlement functions, the civil settlement is due to the concerned parties agreed on their own.In case the parties are not agreed upon, according to the provisions of the Civil Code in 2015, one of the parties to sue to the Civil Court for settlement."
"Recently, I withdraw the original record of cars from Tay Ninh to Khanh Hoa, the traffic police (traffic police) Khanh Hoa reported that my car record was lacking in the second car owner. Previously, my car bought through 3 generations of the owner, I bought it from the third owner and had a valid trading contract, Tay Ninh Traffic Police collected a license plate, issued a temporary license plate and delivered the original file to Khanh Hoa to register for new registration.I want to ask, what should I do when the Khanh Hoa Traffic Police asked me to add an authorization contract to be missing or please confirm from the Tay Ninh Traffic Police to supplement the car to register the car.Currently, I have been returned to the file without any guidance.Thank you!","The content of your question has not yet fully state the vouchers of the transfer of ownership in the vehicle record and the time of transfer of the vehicle ownership of the 2nd car owner, so there is not enough basis to answer specifically.Regarding vouchers of vehicle ownership in case of transfer, moving vehicles to provinces and centrally run cities prescribed at Point c, Clause 1, Article 12 of Circular No. 15/2014/TT-BCA dated April 4, 2014 of the Ministry of Public Security on vehicle registration, as follows: as follows: as follows:

- Decision to sell, donate, donate or sell contracts in accordance with the law.

- Inheritance documents in accordance with the law.

- Sales invoices as prescribed by the Ministry of Finance.

- Paper for sale, giving and donating cars of individuals must be notarized in accordance with the law on notarization or authentication of the People's Committees of communes, wards and townships for the signature of the seller, giving and giving cars in accordance with the law on authentication ...

In case of moving the owner to other provinces or cities directly under the Central Government, there must be a decision to mobilize the work or household registration book instead of the vehicle's transfer of vehicle ownership.

Therefore, it is suggested that you add a complete transfer of vehicle ownership to be settled according to regulations."
"My truck was carrying a cargo when I had a tire explosion.When the traffic police came to check, I explained specifically but the traffic police still made a record of me the error of ""parking a car where there was a parking sign"" right or wrong?","Because your question provides incomplete data, the following 2 cases may occur:

- At the time when the functional forces are present, your vehicle is having a tire explosion and is overcoming and repairing, it can be considered as a case of unexpected events under Clause 13, Article 2 of the Law on Handling of Administrative Violations and functional forces may consider not to sanction administrative violations under Clause 3, Article 11 of the Law on Handling Administrative Violations.

- At the time when the functional forces are present, your vehicle is parking in the effectiveness of the ""parking ban"" sign and you are not performing the repair (although you present to the functional forces you have just repaired), you may still be considered for administrative violations on the act of ""parking cars in the place where there is a banned sign"" in accordance with the law."
"I attended a driving license (GPLX) and has undergone the test, but I have not received the GPLX immediately but I have only been granted an appointment.The Ministry of Public Security asked me, when I participated in traffic while waiting for the license, the traffic police had the right to punish me at fault without a license?","According to Clause 2, Article 58 of the 2008 Road Traffic Law (the conditions of the driver in the traffic) stipulate: “The driver when operating the vehicle must carry the following documents:

- Vehicle registration;

- Driving license for motor vehicle operators specified in Article 59 of this Law;

- Certificate of technical safety testing and environmental protection for motor vehicles prescribed in Article 55 of this Law;

- Certificate of civil liability insurance of motor vehicle owners ”.

Thus, when you control motorcycles in traffic, you must carry a driver's license.When the competent agency checks, at the time of inspection: If you do not carry a driver's license, you will be sanctioned according to the provisions of Point c, Clause 2, Article 21 of Decree No. 46/2016/ND-CP;If you do not have a driver's license, you will be sanctioned according to Point a, Clause 5, Article 21 of Decree No. 46/2016/ND-CP (if your car has a capacity of less than 175cm3) or be sanctioned according to the provisions of Point b, Clause 7, Article 21 of Decree No. 46/2016/ND-CP (if your car has a capacity of 175cm3 or higher)."
"Recently, I drove a car in traffic on the road when the traffic police sanctioned a safe distance.I see very few people who have been sanctioned for such a safe distance, the Ministry of Public Security let me ask, I want to know more about this issue, which document is it?","- Regarding the speed and safety distance of motor vehicles and special-use motorbikes participating in road traffic, specified in Circular No. 91/2015/TT-BGTVT dated December 31, 2015 of the Ministry of Transport.

- Regarding sanctioning car operators violating the regulations on safe distance, prescribed at Point g, Clause 1, Point h, 4, Point c, Clause 8, Article 5 of Decree No. 46/2016/ND-CP of May 26, 2016 of the Government on sanctioning administrative violations in the field of road and railway traffic."
"I drove for the transportation company, my car was carrying wood on the bridge when the traffic police check the vehicle load.My car exceeded the tonnage of 15% road bridge, so I was sanctioned for traffic law violations.I want to ask, my car exceeds such a bridge load, what is the fine and which document is?","- In Clause 2, Article 33 of Decree 46/2016/ND-CP dated May 26, 2016 of the Government stipulating the sanctioning of administrative violations in the field of road and railway traffic stipulating: A fine of between VND 2,000,000 and VND 3,000,000 for vehicle control acts with the total weight (total volume) of the vehicle exceeding the permitted load of the demand and road over 10% to 20%, except for the circulation valid for use;Clause 8, Article 33 stipulates that in addition to being applied by the sanctioning form, the driver of the vehicle is also applied measures to remedy the consequences: forced to lower the overloaded goods, unload the oversized goods according to the instructions of the functional forces at the place where the violation is detected;If damaged the bridge, the road must restore the original condition that has been changed due to administrative violations.

- At Point k, Clause 7, Article 30 of Decree 46/2016/ND-CP dated May 26, 2016 of the Government stipulating: A fine of between VND 2,000,000 and VND 4,000,000 for individuals, from VND 4,000,000 to VND 8,000,000 for organizations who are car owners, tractors, specialized motorbikes and similar vehicles that violate vehicles or let the actor's representative act in the provisions of the Decree46/2016/ND-CP of the Government or directly controlling the means of committing violations specified in Clause 2, Article 33 of Decree 46/2016/ND-CP."
"My truck body weight is 3.4 tons, the volume of goods allowed to be carried in the inspection paper is 4.1 tons, but I am not carrying goods so I am allowed to go into the road with a ban on P.106B (banned 4 -ton car)?","Article 26 of the National Technical Regulation on Road signaling (QCVN 41: 2016/BGTVT) issued together with Circular No. 06/2016/TT-BGTVT, dated April 8, 2016 of the Ministry of Transport prescribes the significance of the license plate P.106 (A, B) is the ban on trucks;At the same time, it is explained in detail (Appendix B, Section B.6, Point B) as follows: “To report the road prohibits trucks with transport volumes (according to the certificate of technical safety and environmental protection testing for road motor vehicles) greater than a certain value, the license plate of P.106B must be placed.The signboard prohibits trucks with transportation volume (determined according to the certificate of technical safety and environmental protection testing for road motor vehicles) greater than the number of digits recorded in the sea (the ton number is white in the shape of the car).The sea is valid for both tractors and special -use motorbikes to go into the road. ”

Thus, readers of readers Ngoc Thinh have a transport volume stated in the certificate of technical safety and environmental protection of 4.1 tons, larger than the digit value stated in the ban on P.106B (banned 4 -ton vehicles), so they are not allowed to enter."
"The Ministry of Public Security asked me, in which case, the traffic police were dressed up to perform the task?","According to Article 9 of Circular No. 01/2016/TT-BCA dated January 4, 2016 of the Ministry of Public Security, defining the tasks, powers, forms and content of road traffic patrol and control of the traffic police stipulating:

“1.Cases of patrol and public control combined with makeup
a) Make up the use of professional technical equipment and equipment, in order to improve the effectiveness of traffic order and safety;
b) Crime prevention and control struggle;When the situation of security, order or order and traffic safety is complicated.

2. The authority decides to patrol and control publicly in combination with costumes
a) The Director of the Traffic Police Department, Director of the provincial Police Department decided to patrol and control publicly in combination with the costumes prescribed in Clause 1 of this Article;
b) The Head of the Traffic and Traffic Control Department of the Traffic Police Department, the Head of Traffic Police Department, the district -level police chief decided to patrol and publicly control in combination with costumes in the case specified at Point a, Clause 1 of this Article.

3. Conditions for patrol and public control combined with costumes
a) There must be a plan of patrolling and controlling the competent person specified in Clause 2 of this Article.The content of the plan must clearly state the implementation methods, forces, communication methods, time, patrol and control area;Means and technical equipment are used for patrol and control;
b) The patrol and control team must arrange a part of cadres in the group to dress up (wear plain clothes) to perform the task of supervising the situation of traffic order, detecting and fighting to prevent violations of law.When detecting violations, they must immediately notify the patrol and public control department to conduct control and handling in accordance with the law;
Masquerade and public patrol and control department in a patrol and control team must keep a suitable distance to ensure timely and legal violations; ”law;”

Thus, the costume police force (wearing plain clothes) to monitor the situation of traffic order, detect and fight to prevent violations of the law that has been strictly regulated by the Ministry of Public Security in the above Circular."
"Recently, my family had a urgent job, so my parents left my sister (15 years old) by motorbike to school.On the way to school, the traffic police asked my brother to stop and call his parents to sanction the act of handing over the car to people who were not eligible for driving.Can the Ministry of Public Security explain to me about this sanction?And which document is the provisions?","- In Clause 1, Article 58 of the Road Traffic Law stipulates that drivers participating in traffic must have sufficient age and health;Points a and b, Clause 1, Article 60 of the Road Traffic Law stipulates that people who are 16 years old or older are allowed to drive a motorbike with a cylinder capacity of less than 50 cm3;People who are 18 years old or older can drive a two-wheel motorbike, a three-wheel motorcycle with a cylinder capacity of 50 cm3 or more and the vehicles have similar structures.Thus, his sister Do Huy (15 years old) is not eligible to control the vehicle.

- In Article 21 of Decree 46/2016/ND-CP of the Government stipulating the warning of people from full 14 years old to under 16 years old driving motorbikes and mopeds (including electric motorbikes) and similar vehicles;Point d, Clause 4, Article 30 of Decree 46/2016/ND-CP of the Government stipulating sanctioning administrative violations for acts of delivery or letting people not eligible as prescribed in Clause 1, Article 58 of the Vehicle Control Law on traffic participating in traffic (including the case of driving vehicles with driving licenses but expired)."
"In the city, there are roads restricting vehicles with large loads but my trucks often have to pay frequent goods and I have asked for permission to enter the full banned road.However, there are many roads that have banned banners forbidden to stop very inconvenient for me in returning goods.The Ministry of Public Security let me ask, can I apply for a license to go to the forbidden route, forbidden to stop?If possible, how to apply for permits?","In Clause 2, Article 37 of the 2008 Road Traffic Law stipulates:
a) The Minister of Transport is responsible for organizing traffic on the national highway system;
b) The President of the provincial People's Committee is responsible for organizing traffic on road systems under its management.

Applying for a license to go to the forbidden road, each locality and provincial People's Committee will assign to the local police or the Department of Transport to licenses.Proposing readers Pham Vu Thang to contact the local police (Traffic Police Department) or Department of Transport for instructions."
"My vehicle is a 1.8 -ton Jac HFC1083K hood truck, recently, I have removed the car tarpaulin to clean, so I forgot to be at home and circulating on the road without a canvas above, when my car circulates on the road was sanctioned by traffic police for changing the car structure.The Ministry of Public Security asked me, how did I be sanctioned for this error and which document?","In Circular No. 42/2014/TT-BGTVT dated September 15, 2014 of the Ministry of Transport, stipulating the trunk of the car, the car, the truck, the truck participating in the road traffic: Clause 4, Article 3 of ""the trunk includes closed containers and open containers"";Clause 5, Article 3 of the stipulation ""open container is a trunk designed in the form of open -faced boxes;The rear wall, the side of the trunk can be opened to arrange and unload.The open container consists of an open container with a hood and an open container without a hood ”;Clause 11, Article 3 of the ""hood covered with coverage and roof frame, mounted on open containers, used to cover goods"";Clause 1, Article 5 of the ""coverage must be canvas"".

In Clause 4, Article 3 of Circular No. 85/2014/TT-BGTVT dated December 31, 2014 of the Ministry of Transport, stipulating the renovation of road motor vehicles stipulating ""Mechanical vehicle improvement is the change of structure, shape, layout, working principles, specifications, specifications of part or the whole system and total formation of motor vehicles.In case of replacement of the system, the sum of the system, the sum of the same type, of the same manufacturer (the same part of the spare parts) is not renovation ”.

Tại Nghị định số 46/2016/NĐ-CP ngày 26/5/2016 của Chính phủ quy định về xử phạt vi phạm hành chính trong lĩnh vực giao thông đường bộ và đường sắt, tại Điểm đ Khoản 3 Điều 16 (Xử phạt người điều khiển xe ô tô vi phạm quy định về điều kiện của phương tiện khi tham gia giao thông) quy định “Phạt tiền từ 800.000 đồng đến 1.000.000 đồng đối với hành vi vi phạm điều khiển xe ô tô tải lắp thùng xe có kích thước không đúng thiết kế của nhà sản xuất hoặc thiết kế cải tạo đã được cơ quancompetent approval ”;Point a, Clause 7, Article 16 of ""performing acts specified in Clause 1;Clause 2;Points C, D, Point d, Clause 3 of this Article shall be forced to fully install or replace equipment to meet technical safety standards, remove additional equipment that are not in accordance with regulations ”.Point a, Clause 9, Article 30 (sanctioning the owner of the vehicle violating the regulations related to road traffic) stipulates: “A fine of between VND 6,000,000 and VND 8,000,000 for individuals, from VND 12,000,000 to VND 16,000,000 for organizations as car owners, tractors, special -use motorbikes and similar vehicles to one of the acts of transmitting the brake system, the system of the system, the system of the transmission system, the system of the transmission system, the system of the transmission system, the system of the transmission system (the engine system)., the system of motion or arbitrary improvement of the structure, shape, size of the vehicle, the trunk or arbitrarily installed, removed the seats and beds (for passenger cars) not in accordance with the design of the manufacturer or renovation design that has been approved by the competent authority;arbitrarily change the use of the vehicle ”.Point i Clause 14, Article 30 stipulates: ""Performing acts specified at Point a Clause 9 of this Article is deprived of the right to use the certificate of technical safety and environmental safety testing and the inspection stamps of the vehicle from 01 month to 03 months"".Point b, Clause 15, Article 30 stipulates: ""The act of performing the act at Point a Clause 9 of this Article must restore the shape, size, and safety status of the vehicle's initial technical and register before bringing the vehicle to the traffic"".

In order to determine the violation, the competent person conducts actual comparison of vehicles with the certificate of technical safety inspection and environmental protection issued by competent agencies and current regulations as a basis for determining sanctioning administrative violations."
