question,answer
"How is the act of controlling the car or hammock on the inner road, outside the urban sanctioned administrative violations?","At Point b, Clause 8, Article 6 of Decree 100/2019/ND-CP dated December 30, 2019 of the Government stipulating the sanctioning of administrative violations in the field of road and railway traffic stipulated as follows: A fine of between VND 6,000,000 and VND 8,000,000 for car drivers who carry out acts of controlling cars or hammocks on road and urban roads. In addition to being fined, the driver of the vehicle committing the violation is also applied the following form of additional sanctions: committing the above violation, they are deprived of the right to use the driver's license from 02 months to 04 months. Recidivism or violation of the above acts are deprived of the right to use the driver's license from 03 months to 05 months, confiscating vehicles."
"Acting of traffic accidents does not stop, does not keep the scene, fled without reporting to the competent authority, does not participate in emergency of victims who are sanctioned for administrative violations?","At Point d, Clause 8, Article 6 of Decree 100/2019/ND-CP dated December 30, 2019 of the Government stipulating the sanctioning of administrative violations in the field of road and railway traffic prescribed as follows: A fine of between VND 6,000,000 and VND 8,000,000 for car operators who commit acts of causing traffic accidents does not stop, does not keep the scene, fled to report to the competent authority. In addition to being fined, the driver of the vehicle committing the violation is also applied the following form of additional sanctions: committing the above violation, the right to use the driver's license from 03 months to 05 months."
Vehicle control on the road where blood or breath has alcohol content exceeds 80 milligrams/100 milliliters or exceeding 0.4 milligrams/1 liter of breathing gas sanctioned administrative violations?,"At Point e, Clause 8, Article 6 of Decree 100/2019/ND-CP dated December 30, 2019 of the Government stipulating the sanctioning of administrative violations in the field of road and railway traffic prescribed as follows: A fine of between VND 6,000,000 and VND 8,000,000 for car drivers who perform vehicle operations on roads where blood or breathing with alcohol content in excess of 80 milligrams/100 milligrids or exceeding 0.4 milligrams/1 liters/1 liter of gas/1 liter/1 liter/1 liter/1 liter/1 liter/1 liter of gas In addition to being fined, the driver of the vehicle committing the violation is also applied the following form of additional sanctions: committing the above violation, deprived of the right to use the driver's license from 22 months to 24 months. III. Sanctions with motorbike drivers, engine bicycles (including electric bicycles), other rudimentary drivers violate road traffic rules."
"The act of not going to the right in the direction of his go, going not in accordance with the prescribed road; stopping the car suddenly; How does the direction do not signal to be sanctioned for administrative violations?","At Points a, b, Clause 1, Article 8 of the Government's Decree 100/2019/ND-CP of December 30, 2019, stipulating the sanctioning of administrative violations in the field of road and railway traffic stipulated as follows: A fine of between VND 80,000 and VND 100,000 for car drivers who commit one of the following violations: Do not go on the right side in their own direction, not in accordance with the prescribed road; Stop the car suddenly; Do not signal in advance."
"The act of using a stroller as a mobile store on the road, hindering traffic sanctions on administrative violations?","At Point m, Clause 1, Article 8 of Decree 100/2019/ND-CP of December 30, 2019 of the Government stipulating the sanctioning of administrative violations in the field of road and railway traffic stipulated as follows: A fine of between VND 80,000 and VND 100,000 for car drivers who use trolleys as mobile stalls on roads, interfere with traffic."
The act does not obey the order and instructions of the traffic driver or traffic control person; Do not obey the command of traffic lights sanctioned administrative violations?,"At Points b, dd Clause 2, Article 8 of the Government's Decree 100/2019/ND-CP of December 30, 2019, stipulating the sanctioning of administrative violations in the field of road and railway traffic stipulated as follows: A fine of from VND 100,000 to VND 200,000 for car operators committing one of the following violations: failing to comply with orders, instructions of traffic operators or traffic control people; Do not obey the command of traffic lights."
"Machinery operators (including electric bicycles) do not wear ""helmets for motorcyclists, motorbikes"" or wear ""helmets for motorcyclists, motorbikes"" without proper straps when participating in traffic on the road being sanctioned for administrative violations?","At Point d, Clause 3, Article 8 of Decree 100/2019/ND-CP dated December 30, 2019 of the Government stipulating the sanctioning of administrative violations in the field of road and railway traffic stipulated as follows: A fine of from VND 200,000 to VND 300,000 for motorbike drivers (including electric bicycles) without ""helmets for motorcyclists, motorcycles"" or ""insurance hats for motorbikes and motorbikes set."
Vehicle control on the road where blood or breath has alcohol content exceeds 50 milligrams to 80 milligrams/100 milliliters or exceeding 0.25 milligrams to 0.4 milligrams/1 liter of breathing gas sanctioned administrative violations?,"At Point e, Clause 3, Article 8 of Decree 100/2019/ND-CP dated December 30, 2019 of the Government stipulating the sanctioning of administrative violations in the field of road and railway traffic stipulated as follows: A fine of between VND 200,000 to VND 300,000 for car drivers who perform vehicle control on roads where blood or breathing with alcohol content is exceeding 50 milligrams/100 milligrids or exceeding 0.25 milligrids to 0.25 milligraphic to 0.44 Miligam/1 liter of breathing gas"
The act of controlling the car on the road where the blood or breath has an alcohol content in excess of 80 milligrams/100 milliliters or exceeding 0.4 milligrams/1 liter of breathing gas and does not comply with the testing request for the alcohol content of the person on duty to be sanctioned for administrative violations?,"At Points C, d, Clause 4, Article 8 of the Government's Decree 100/2019/ND-CP of December 30, 2019, stipulating the sanctioning of administrative violations in the field of road and railway traffic prescribed as follows: A fine of between VND 400,000 and VND 600,000 for the driver who commits one of the following violations: controlling the vehicle on the road where the blood or breath has alcohol excess of 80 milligrams/100 milligras Liters of breathing gas and failing to comply with the testing request for the alcohol content of the person on duty. Jade Performance belongs to: Vinh Phuc Provincial Law Dissemination Council Visitors:"
"Railway Transport Company X specializes in transporting goods, one time the functional force carrying out the cargo load weighing in the station area has discovered that each wagon over a total of 12 cars exceeds the permitted load of the wagon is 10%, so it is required to lower the load and be sanctioned for administrative violations. I want to ask, according to the provisions of the law, the penalty for the violation of the railway transport company X is how much?","The act of carrying goods exceeding the permitted load of the railway vehicle, exceeding the permitted load of the roads, causing unsafe during transportation and damaging the roadway system. For this act, the law provides for administrative sanctions stated at Point a, Clause 2, Article 65 of the Government's Decree No. 100/2019/ND-CP of December 30, 2019 on the regulation of sanctioning administrative violations in the field of road and railway transport (hereinafter referred to as Decree 100/2019/ND-CP) as follows: A fine of between VND 3,000,000 and 5,000,000 VND for the operation of the operation of the railway line to carry out the transportation of the railway line on the transport of the railway line on the shift of the railway line on the transport of the railway line to carry out the transport of the railway line on the shipping of the railway line to carry out the transport of the railway line to carry out the transportation of the railway line on the shipping of the railway line on the shipping of the railway line on the shipping of the railway line on the transport of the railway line on the operation of the railway line. Each wagon exceeds the allowable load of the wagon over 5% to 40%. Thus, with the act of carrying goods in excess of the permitted load of the aforementioned wagon, the railway transport company X may be sanctioned for administrative violations with a fine of between VND 3,000,000 and 5,000,000."
Can traffic people stop on the road to wear raincoats?,"Thank you to the reader for sending questions to the Ministry of Public Security and always interested in traffic safety.Currently, the law does not prohibit and has specified instructions on/parking, to ensure the most convenience and protect the safe traffic participants.Cases of stopping/parking, including stopping/parking to wear raincoats;Only sanctioned when not complying with the law on traffic safety, endangering themselves and other traffic participants ....
Specifically: Article 18 of the Law on Traffic Safety Order 2024 stipulates the stop and parking, according to which:
“3.The driver of the vehicle participating in road traffic when stopping the car and parking on the road must comply with the following regulations:
a) There is a signal notifying the driver of other road traffic to know when it comes to, the position of stopping the vehicle, parking;
b) Do not affect pedestrians and vehicles participating in road traffic.
4. Drivers of vehicles participating in road traffic must not stop, parking at the following locations:
a) On the left of one -way road;
b) On the curve or near the slope, the vision is obscured;
c) On the bridge, except for cases of transportation organizations;
d) Book overpass, except for places where car stops and parking are allowed;
d) Parallel to the same direction as another car is stopping, parking on the road;
e) The way the car is parked in the opposite direction of less than 20 meters on the narrow street,
Under 40 meters on the road there is a motor lane on one direction;
g) On the pedestrian road section;
h) The intersection of the intersection and within 05 meters from the edge of the intersection;
i) Picking and returning points;
k) In front of the gate and within 05 meters on both sides of the headquarters of the offices and organizations, there is a road arrangement for the car and in and out;
l) At the width of the road is only enough for a motor lane;
m) Within the safety of the railway;
n) obscure road signs, traffic lights;
o) On the road reserved for buses, sewers, tunnel mouths of telephone, high voltage electricity, reserved for fire -fighting vehicles;On the road, sidewalks contrary to the law.
5. On the road, drivers of vehicles participating in road traffic are only stopped, parked in a large roadside or land outside the road running;In case the roadside is narrow or without the curb, the car is only stopped, parked close to the right edge of the road in the direction of its go.
6. On the street, drivers of vehicles participating in road traffic are only stopped, parked close to the curb, sidewalk on the right side of their direction;The nearest wheel is not far from the curb, the sidewalk is more than 0.25 meters and does not obstruct, dangerous for people and vehicles participating in road traffic. ”
For violations, depending on the behavior and type of vehicle, it may be administratively sanctioned according to the provisions of Decree 168/2024/ND-CP dated December 26, 2024 stipulating sanctioning administrative violations of traffic order and safety in the field of road traffic;deducting points, restoring the driver's license point.
I wish you safe traffic!"
"I have a self -drive car rental to customers, after the customer pays the car, I checked but due to the late update system, the next few days I discovered that the vehicle violated the traffic by the car tenant.Shortly thereafter, I called the car rental guests, but the customer did not recognize the fault that he caused (I had a car rental and a photo card photo and a driver's license).

I want to ask the Ministry of Public Security, if the car tenant refuses to cooperate with the police to handle, will the car owner be fined?If the vehicle owner is not fined, there is any sanctions that have to handle the above behavior?","1. About identify the violator:

Pursuant to Clause 8, Article 47 of Decree No. 168/2024/ND-CP of December 26, 2024 of the Government stipulating sanctioning administrative violations of traffic order and safety in the field of road traffic;deducting points, restoring driving license points (Decree 168);specifically:

""8. For cases of administrative violations detected through the use of professional vehicles and technical equipment that the authorities have not stopped immediately the means of handling, the following:

a) Authorities send a notice requesting the owner of the vehicle and the relevant organization (if any) to the offices of agencies and units of the competent person to sanction administrative violations to resolve the case.The notice is made in writing or making notifications by electronic methods through the application of transportation on mobile devices for citizens (hereinafter referred to as the application of transportation on mobile devices) by the Ministry of Public Security in construction, management and operation when meeting the conditions of infrastructure, technical and information;at the same time, update information about the violating means on the website of the Traffic Police Department;

b) The vehicle owner is obliged to cooperate with the authorities to determine the person who has operated the vehicle committing the violation.

In case the vehicle owner is an individual, if he does not cooperate with the authorities, does not prove or fails to explain, he is not the one who drove the vehicle to commit violations, he was sanctioned for the detected violation;

In case the vehicle owner is an organization, if it is not cooperated with the authorities, it is not explained to determine the person who has driven the vehicle that commits violations, the sanctioning of administrative violations for the organization commits the violation detected, unless the vehicle is appropriated or illegally used "".
2. Regarding sanctions for handling the above violations

Pursuant to the provisions of Clause 11, Article 47 of Decree 168 stipulating the handling of cases where violators have not yet carried out the case of violations as prescribed, specifically:

""11. In case of an appointment period to resolve the case of violations stated in the minutes of administrative violations or in the notice of the person competent to sanction or the time limit for execution of the sanctioning decision but the vehicle owner, the violator who has not made the case of violations as prescribed or has not complied with the sanctioning decision, the sanctioned person to send the notice to the registry (for vehicles with the vehicle, the vehicle is required)(If the violator has been identified)

a) Register, vehicle registration agencies, driving licensing agencies before carrying out, vehicle registration, issuance, exchange and re -issuance of driving licenses shall look up violating vehicle data, violators sent by the Traffic Police Agency;

b) In case of searching data as prescribed at Point a of this Clause, if there is information on violations or violators, the violators have not yet resolved the registration and registration of violations, not yet granted, renewed or re -granted driving licenses for violators;

c) After the owner of the vehicle and the violator resolved the case of violations according to the regulations, the sanctioning competent person must immediately send a notice to the sword post office, the vehicle registration agency, the driving license agency in writing or in the form of connection and sharing of data when meeting the conditions of infrastructure, technical and information to carry out the registry, vehicle registration, and return of the driver."
"The Ministry of Public Security let me ask, in case the driver does not obey the traffic light signal to give way to the priority vehicle, is the ambulance sanctioned under Decree 168?","Article 11 of the Law on Handling of Administrative Violations also clearly stipulates that there is no sanction of violations in an urgent situation;
Clause 5, Article 27 of the Law on Road Traffic and Traffic Safety No. 36/2024 requires when there is a signal of a priority vehicle, people and vehicles participating in road traffic must slow down, close to the right side of the road or stop to give way, toll station must prioritize the priority vehicle through all situations, not to be obstructed.
Therefore, the people are assured, the failure to comply with the traffic light signals to give way to the ambulance and the priority vehicle in the case of ""urgent situation"" will not be sanctioned for administrative violations.In these cases, when making a sanctioning record, the signal lamp force will coordinate with the traffic police at the pin, extract the camera, the image of the driver's violation, show the evolution of violations and the light signal at that time.
For the cold penalty, the traffic police will let the violators review the full clip of the violation of the red light before making the record, ensuring the people ""mind, the mouth"", avoiding wrongdoing."
"Previously I resided in Hanoi, now I moved to Ho Chi Minh City.I want to ask the Ministry of Public Security, my case has to change the car registration when you move in?If I have to change, what procedures do I have to do?","Clause 1, Clause 2, Article 13 of Circular No. 24/2023/TT-BCA of July 1, 2023 of the Ministry of Public Security stipulating the grant, registration of registration, motor vehicle number plates, regulations:

“1.When transferring the ownership of vehicles or moving offices, residents from provinces or centrally run cities to other provinces or centrally run cities (hereinafter collectively referred to as the owner of the owner), the owner must carry out the recovery procedure at the agency that is managing that car record.2. Organizations and individuals who transfer vehicle ownership and owner (in case of moving the original owner) carry out procedures for registering their names and moving vehicles at the vehicle registration agency as prescribed in Article 4 of this Circular ”.

Procedures for recovery documents for vehicle registration certificates are specified in Clause 1, Article 14 of Circular No. 24/2023/TT-BCA, including: registration certificate, vehicle license plate;papers of the vehicle owner as prescribed in Article 10 of Circular No. 24/2023/TT-BCA;02 copies of machine number, frame number;Car registration certification;The owner of the car does not have to return the license plate, except for the case that the vehicle has registered as a 3 or 4 -digit plate, the 3 or 4 -digit plate must be returned;In case of loss of vehicle registration certificate or a license plate, the reason must be clearly stated in the registration certificate, license plate.Procedures for vehicle registration documents (Moving the owner) are specified in Clause 2, Article 14 of Circular 24/2023/TT-BCA, including: Car registration certificate;The papers of the vehicle owner specified in Article 10 of Circular No. 24/2023/TT-BCA;Vouchers of registration fee as prescribed in Clause 3, Article 11 of Circular No. 24/2023/TT-BCA;Certificate of registration, license plate.

-Clause 3, Article 20 of Circular No. 79/2024/TT-BCA dated November 15, 2024 stipulates the issuance and revocation of vehicle registration certificates, motor vehicles, special-use motorbikes (replacing Circular No. 24/2023/TT-BCA, effective from January 1, 2025) stipulating the case of changing the vehicle registration certificate when the owner changes its headquarters, residence to the new vehicle registration agency that has been registered by the vehicle registration agency.

Regarding the procedure for confirming the vehicle file: submitting the vehicle registration certificate and the application for confirmation of the vehicle application (according to the form of DKX13 issued together with Circular 79/2024/TT-BCA) to the vehicle registration agency for the vehicle record to be granted a vehicle file confirmation.

Procedures for vehicle registration documents (moving the owner), including: Car registration certificate and vehicle record confirmation.

Thus, in case of carrying out procedures for exchanging vehicle registration certificates at the new address before January 1, 2025, the provisions of Circular 24/2023/TT-BCA of the Ministry of Public Security;From January 1, 2025, the provisions of Circular No. 79/2024/TT-BCA of the Ministry of Public Security."
"When participating in traffic, I found that the phenomenon of traffic lights ""green suddenly turned red"" caused traffic participants to be unjustly punished.I would like to ask the Ministry of Public Security, in case the people drove through the road with the signal light ""green suddenly turned to red"", is it sanctioned?","1. The cause of the above situation is due to some old generation traffic signals, manual control should be delayed when adjusting the lamp cycle during the day.Accordingly, a traffic signal lamppost will transfer the cycle from the peak hour frame to a low point or vice versa.To overcome this situation, the Traffic Police Department (Traffic Police) - Ministry of Public Security has issued a document to direct the local police, coordinate with the authorities to review and repair signal lights, propose operators to operate and manage traffic lights soon upgrade old lights.The intersection with the phenomenon of ""dancing lights"", the traffic police will not punish, in addition, the lamp phenomenon is not much.""People are assured that they will not be unjustly punished by the traffic police in these cases. When making a sanctioning record, the signal lamp force will coordinate with the traffic police at the pin, extract the camera, the image of the car driver's violation, showing the evolution of violations and the light signal at that time.""For the cold penalty, the traffic police will allow the violator to review the whole clip of the violation of the red light before making a record, ensuring the people ""mind, the password"", avoiding wrongdoing.
2. In case the driver does not comply with the light signal to give way to the priority vehicle, ambulance ... will not be sanctioned due to the Law on Handling of Administrative violations, which does not sanction administrative violations in case of committing administrative violations in an urgent situation."
"Recently, in some places, people have sprayed paint and applied dirt on traffic signs to deal with functional forces in the process of handling violations against vehicles banned from circulating on roads.The Ministry of Public Security let me ask, the act of applying dirt or spraying paint to erase traffic signs to deal with the functional forces will be handled like?","Point b, Clause 2, Article 17 of Decree No. 144/2021/ND-CP of December 31, 2021 of the Government stipulating sanctioning administrative violations in the field of security, order and social safety;prevention and control of social evils;Fire prevention, fighting, rescue and rescue;Prevention and control of domestic violence stipulates: A fine of between VND 1,000,000 and VND 2,000,000 shall be imposed for acts of ""dismantling, destroying or doing anything else to damage the types of signs, instruction signs and signboards of agencies and organizations"".In addition, the person who commits violations is also applied for additional sanctions for confiscation of material evidences and means of administrative violations and measures to overcome the consequences forced to restore the original situation."
